{
  "schema_version": "1.0",
  "job_id": "job-web-c3e382183000",
  "defects": [
    {
      "id": "DEF-001",
      "case_id": "TC-004",
      "interface_id": "IF-REST-001",
      "failure_reason": "HTTP 200（语义断言：status=401；前端拦截器捕获后重定向至登录页）",
      "reproduce": {
        "script_path": "scripts/test_TC_004.py",
        "params": {
          "body": {
            "username": "admin",
            "password": "***"
          }
        }
      },
      "status": "retained",
      "is_fallback": false,
      "history": [
        {
          "event": "discovered",
          "timestamp": "2026-09-17T07:27:58.843806+00:00"
        },
        {
          "event": "retest_started",
          "timestamp": "2026-09-17T07:28:34.331887+00:00"
        },
        {
          "event": "retest_failed",
          "timestamp": "2026-09-17T07:28:34.331887+00:00"
        },
        {
          "event": "retained",
          "timestamp": "2026-09-17T07:28:34.331887+00:00"
        },
        {
          "event": "retest_started",
          "timestamp": "2026-09-17T07:51:48.298108+00:00"
        },
        {
          "event": "retest_failed",
          "timestamp": "2026-09-17T07:51:48.298108+00:00"
        },
        {
          "event": "retained",
          "timestamp": "2026-09-17T07:51:48.298108+00:00"
        }
      ]
    },
    {
      "id": "DEF-002",
      "case_id": "TC-013",
      "interface_id": "IF-REST-004",
      "failure_reason": "HTTP 400（语义断言：status=201；响应 transaction_account_id 非空）",
      "reproduce": {
        "script_path": "scripts/test_TC_013.py",
        "params": {
          "body": {
            "investor_name": "张三",
            "id_type": "0",
            "id_no": "11010519491231002X",
            "cellphone": "13800138000"
          }
        }
      },
      "status": "retained",
      "is_fallback": false,
      "history": [
        {
          "event": "discovered",
          "timestamp": "2026-09-17T07:28:07.125551+00:00"
        },
        {
          "event": "retest_started",
          "timestamp": "2026-09-17T07:28:34.547870+00:00"
        },
        {
          "event": "retest_failed",
          "timestamp": "2026-09-17T07:28:34.547870+00:00"
        },
        {
          "event": "retained",
          "timestamp": "2026-09-17T07:28:34.547870+00:00"
        },
        {
          "event": "retest_started",
          "timestamp": "2026-09-17T07:51:48.683454+00:00"
        },
        {
          "event": "retest_failed",
          "timestamp": "2026-09-17T07:51:48.683454+00:00"
        },
        {
          "event": "retained",
          "timestamp": "2026-09-17T07:51:48.683454+00:00"
        }
      ]
    },
    {
      "id": "DEF-003",
      "case_id": "TC-024",
      "interface_id": "IF-REST-007",
      "failure_reason": "HTTP 400（语义断言：status=201；响应包含非空 ec_ap_serial_no 与成功消息）",
      "reproduce": {
        "script_path": "scripts/test_TC_024.py",
        "params": {
          "body": {
            "fund_code": "000330",
            "share_type": "A",
            "application_amount": "10000.00",
            "currency_type": "156"
          }
        }
      },
      "status": "retained",
      "is_fallback": false,
      "history": [
        {
          "event": "discovered",
          "timestamp": "2026-09-17T07:28:10.010738+00:00"
        },
        {
          "event": "retest_started",
          "timestamp": "2026-09-17T07:28:34.792546+00:00"
        },
        {
          "event": "retest_failed",
          "timestamp": "2026-09-17T07:28:34.792546+00:00"
        },
        {
          "event": "retained",
          "timestamp": "2026-09-17T07:28:34.792546+00:00"
        },
        {
          "event": "retest_started",
          "timestamp": "2026-09-17T07:51:48.925790+00:00"
        },
        {
          "event": "retest_failed",
          "timestamp": "2026-09-17T07:51:48.925790+00:00"
        },
        {
          "event": "retained",
          "timestamp": "2026-09-17T07:51:48.925790+00:00"
        }
      ]
    },
    {
      "id": "DEF-004",
      "case_id": "TC-033",
      "interface_id": "IF-REST-009",
      "failure_reason": "HTTP 400（语义断言：status=200；响应为非空账户数组）",
      "reproduce": {
        "script_path": "scripts/test_TC_033.py",
        "params": {
          "query": "investor_name=张三"
        }
      },
      "status": "retained",
      "is_fallback": false,
      "history": [
        {
          "event": "discovered",
          "timestamp": "2026-09-17T07:28:12.282540+00:00"
        },
        {
          "event": "retest_started",
          "timestamp": "2026-09-17T07:28:35.002886+00:00"
        },
        {
          "event": "retest_failed",
          "timestamp": "2026-09-17T07:28:35.002886+00:00"
        },
        {
          "event": "retained",
          "timestamp": "2026-09-17T07:28:35.002886+00:00"
        },
        {
          "event": "retest_started",
          "timestamp": "2026-09-17T07:51:49.198347+00:00"
        },
        {
          "event": "retest_failed",
          "timestamp": "2026-09-17T07:51:49.198347+00:00"
        },
        {
          "event": "retained",
          "timestamp": "2026-09-17T07:51:49.198347+00:00"
        }
      ]
    },
    {
      "id": "DEF-005",
      "case_id": "TC-034",
      "interface_id": "IF-REST-009",
      "failure_reason": "HTTP 400（语义断言：status=200；响应包含分页列表）",
      "reproduce": {
        "script_path": "scripts/test_TC_034.py",
        "params": {
          "query": ""
        }
      },
      "status": "retained",
      "is_fallback": false,
      "history": [
        {
          "event": "discovered",
          "timestamp": "2026-09-17T07:28:12.559245+00:00"
        },
        {
          "event": "retest_started",
          "timestamp": "2026-09-17T07:28:35.234158+00:00"
        },
        {
          "event": "retest_failed",
          "timestamp": "2026-09-17T07:28:35.234158+00:00"
        },
        {
          "event": "retained",
          "timestamp": "2026-09-17T07:28:35.234158+00:00"
        },
        {
          "event": "retest_started",
          "timestamp": "2026-09-17T07:51:49.587739+00:00"
        },
        {
          "event": "retest_failed",
          "timestamp": "2026-09-17T07:51:49.587739+00:00"
        },
        {
          "event": "retained",
          "timestamp": "2026-09-17T07:51:49.587739+00:00"
        }
      ]
    },
    {
      "id": "DEF-006",
      "case_id": "TC-036",
      "interface_id": "IF-REST-010",
      "failure_reason": "HTTP 400（语义断言：status=200；响应包含 count 与 results 数组，分页默认 20 条）",
      "reproduce": {
        "script_path": "scripts/test_TC_036.py",
        "params": {
          "query": "ec_cust_no=EC-CUST-2025-0001&page=1"
        }
      },
      "status": "retained",
      "is_fallback": false,
      "history": [
        {
          "event": "discovered",
          "timestamp": "2026-09-17T07:28:12.933287+00:00"
        },
        {
          "event": "retest_started",
          "timestamp": "2026-09-17T07:28:35.443149+00:00"
        },
        {
          "event": "retest_failed",
          "timestamp": "2026-09-17T07:28:35.443149+00:00"
        },
        {
          "event": "retained",
          "timestamp": "2026-09-17T07:28:35.443149+00:00"
        },
        {
          "event": "retest_started",
          "timestamp": "2026-09-17T07:51:49.997501+00:00"
        },
        {
          "event": "retest_failed",
          "timestamp": "2026-09-17T07:51:49.997501+00:00"
        },
        {
          "event": "retained",
          "timestamp": "2026-09-17T07:51:49.997501+00:00"
        }
      ]
    },
    {
      "id": "DEF-007",
      "case_id": "TC-040",
      "interface_id": "IF-REST-010",
      "failure_reason": "HTTP 400（语义断言：status=200；响应 results 为空数组）",
      "reproduce": {
        "script_path": "scripts/test_TC_040.py",
        "params": {
          "query": "ec_ap_serial_no=NEVER-EXIST-SERIAL-9999"
        }
      },
      "status": "retained",
      "is_fallback": false,
      "history": [
        {
          "event": "discovered",
          "timestamp": "2026-09-17T07:28:13.817255+00:00"
        },
        {
          "event": "retest_started",
          "timestamp": "2026-09-17T07:28:35.646713+00:00"
        },
        {
          "event": "retest_failed",
          "timestamp": "2026-09-17T07:28:35.646713+00:00"
        },
        {
          "event": "retained",
          "timestamp": "2026-09-17T07:28:35.646713+00:00"
        },
        {
          "event": "retest_started",
          "timestamp": "2026-09-17T07:51:50.239179+00:00"
        },
        {
          "event": "retest_failed",
          "timestamp": "2026-09-17T07:51:50.239179+00:00"
        },
        {
          "event": "retained",
          "timestamp": "2026-09-17T07:51:50.239179+00:00"
        }
      ]
    },
    {
      "id": "DEF-008",
      "case_id": "TC-045",
      "interface_id": "IF-REST-012",
      "failure_reason": "HTTP 200（语义断言：status=400；响应提示\"下单/落库数据为空，无法对账\"）",
      "reproduce": {
        "script_path": "scripts/test_TC_045.py",
        "params": {
          "body": {
            "trigger_type": "manual"
          }
        }
      },
      "status": "retained",
      "is_fallback": false,
      "history": [
        {
          "event": "discovered",
          "timestamp": "2026-09-17T07:28:15.574339+00:00"
        },
        {
          "event": "retest_started",
          "timestamp": "2026-09-17T07:28:35.914489+00:00"
        },
        {
          "event": "retest_failed",
          "timestamp": "2026-09-17T07:28:35.914489+00:00"
        },
        {
          "event": "retained",
          "timestamp": "2026-09-17T07:28:35.914489+00:00"
        },
        {
          "event": "retest_started",
          "timestamp": "2026-09-17T07:51:50.569909+00:00"
        },
        {
          "event": "retest_failed",
          "timestamp": "2026-09-17T07:51:50.569909+00:00"
        },
        {
          "event": "retained",